{
    "$schema":  "../../schema/fields.schema.json",
    "schema_version":  "1.0.0",
    "form_id":  "0619e-v2018",
    "revision":  "2018-01-01",
    "field_count":  59,
    "runtime_serializable_element_count":  59,
    "inventory_sha256":  "0a4b595e472e1f1b3b6863fcf47d5c1f8f5c616a580c74e36f5fdc5e5aac06be",
    "fields":  [
                   {
                       "field_key":  "frm0619E:txtMonth",
                       "serialized_key":  "frm0619E:txtMonth",
                       "serialized_occurrence":  1,
                       "label":  "frm0619E:txtMonth",
                       "page":  1,
                       "item_number":  "1",
                       "control_kind":  "select",
                       "storage_type":  "string",
                       "logical_type":  "code",
                       "required":  "required",
                       "required_when":  null,
                       "enabled_when":  null,
                       "visible_when":  null,
                       "default_value":  null,
                       "empty_representation":  "",
                       "constraints":  {

                                       },
                       "enum_values":  [
                                           {
                                               "value":  "01",
                                               "label":  "01 - January"
                                           },
                                           {
                                               "value":  "02",
                                               "label":  "02 - February"
                                           },
                                           {
                                               "value":  "03",
                                               "label":  "03 - March"
                                           },
                                           {
                                               "value":  "04",
                                               "label":  "04 - April"
                                           },
                                           {
                                               "value":  "05",
                                               "label":  "05 - May"
                                           },
                                           {
                                               "value":  "06",
                                               "label":  "06 - June"
                                           },
                                           {
                                               "value":  "07",
                                               "label":  "07 - July"
                                           },
                                           {
                                               "value":  "08",
                                               "label":  "08 - August"
                                           },
                                           {
                                               "value":  "09",
                                               "label":  "09 - September"
                                           },
                                           {
                                               "value":  "10",
                                               "label":  "10 - October"
                                           },
                                           {
                                               "value":  "11",
                                               "label":  "11 - November"
                                           },
                                           {
                                               "value":  "12",
                                               "label":  "12 - December"
                                           }
                                       ],
                       "normalization":  [

                                         ],
                       "computed":  false,
                       "calculation_id":  null,
                       "source_refs":  [
                                           "xml-encrypted#decrypted-field:frm0619E:txtMonth",
                                           "official-hta-runtime#control:L278"
                                       ],
                       "confidence":  "high",
                       "notes":  [
                                     "Present in the revision-matched encrypted final-copy inventory; values excluded."
                                 ]
                   },
                   {
                       "field_key":  "frm0619E:txtYear",
                       "serialized_key":  "frm0619E:txtYear",
                       "serialized_occurrence":  1,
                       "label":  "frm0619E:txtYear",
                       "page":  1,
                       "item_number":  "1",
                       "control_kind":  "text",
                       "storage_type":  "string",
                       "logical_type":  "code",
                       "required":  "required",
                       "required_when":  null,
                       "enabled_when":  null,
                       "visible_when":  null,
                       "default_value":  "",
                       "empty_representation":  "",
                       "constraints":  {
                                           "max_length":  4
                                       },
                       "enum_values":  [

                                       ],
                       "normalization":  [

                                         ],
                       "computed":  false,
                       "calculation_id":  null,
                       "source_refs":  [
                                           "xml-encrypted#decrypted-field:frm0619E:txtYear",
                                           "official-hta-runtime#control:L292"
                                       ],
                       "confidence":  "high",
                       "notes":  [
                                     "Present in the revision-matched encrypted final-copy inventory; values excluded."
                                 ]
                   },
                   {
                       "field_key":  "frm0619E:txtDueMonth",
                       "serialized_key":  "frm0619E:txtDueMonth",
                       "serialized_occurrence":  1,
                       "label":  "frm0619E:txtDueMonth",
                       "page":  1,
                       "item_number":  "2",
                       "control_kind":  "text",
                       "storage_type":  "string",
                       "logical_type":  "code",
                       "required":  "computed",
                       "required_when":  null,
                       "enabled_when":  null,
                       "visible_when":  null,
                       "default_value":  null,
                       "empty_representation":  "",
                       "constraints":  {
                                           "max_length":  2
                                       },
                       "enum_values":  [

                                       ],
                       "normalization":  [

                                         ],
                       "computed":  true,
                       "calculation_id":  "See calculations.json",
                       "source_refs":  [
                                           "xml-encrypted#decrypted-field:frm0619E:txtDueMonth",
                                           "official-hta-runtime#control:L307"
                                       ],
                       "confidence":  "high",
                       "notes":  [
                                     "Present in the revision-matched encrypted final-copy inventory; values excluded."
                                 ]
                   },
                   {
                       "field_key":  "frm0619E:txtDueDay",
                       "serialized_key":  "frm0619E:txtDueDay",
                       "serialized_occurrence":  1,
                       "label":  "frm0619E:txtDueDay",
                       "page":  1,
                       "item_number":  "2",
                       "control_kind":  "text",
                       "storage_type":  "string",
                       "logical_type":  "code",
                       "required":  "required",
                       "required_when":  null,
                       "enabled_when":  null,
                       "visible_when":  null,
                       "default_value":  "10",
                       "empty_representation":  "",
                       "constraints":  {
                                           "max_length":  2
                                       },
                       "enum_values":  [

                                       ],
                       "normalization":  [

                                         ],
                       "computed":  false,
                       "calculation_id":  null,
                       "source_refs":  [
                                           "xml-encrypted#decrypted-field:frm0619E:txtDueDay",
                                           "official-hta-runtime#control:L308"
                                       ],
                       "confidence":  "high",
                       "notes":  [
                                     "Present in the revision-matched encrypted final-copy inventory; values excluded."
                                 ]
                   },
                   {
                       "field_key":  "frm0619E:txtDueYear",
                       "serialized_key":  "frm0619E:txtDueYear",
                       "serialized_occurrence":  1,
                       "label":  "frm0619E:txtDueYear",